{
  "$schema": "https://json-schema.org/draft/2020-12/schema",
  "$id": "https://allen.is/infereval/schema/benchmark-1.0.json",
  "title": "infereval benchmark (beta)",
  "$defs": {
    "AnalystModel": {
      "additionalProperties": false,
      "description": "A human analyst :math:`a_j` whose verdicts appear in :math:`V_i`.",
      "properties": {
        "id": {
          "title": "Id",
          "type": "string"
        },
        "display_name": {
          "anyOf": [
            {
              "type": "string"
            },
            {
              "type": "null"
            }
          ],
          "default": null,
          "title": "Display Name"
        },
        "notes": {
          "anyOf": [
            {
              "type": "string"
            },
            {
              "type": "null"
            }
          ],
          "default": null,
          "title": "Notes"
        }
      },
      "required": [
        "id"
      ],
      "title": "AnalystModel",
      "type": "object"
    },
    "BearerModel": {
      "additionalProperties": false,
      "description": "JSON shape for a :class:`infereval.types.Bearer`.",
      "properties": {
        "expression": {
          "title": "Expression",
          "type": "string"
        },
        "paraphrases": {
          "default": [],
          "items": {
            "type": "string"
          },
          "title": "Paraphrases",
          "type": "array"
        },
        "references": {
          "items": {
            "$ref": "#/$defs/Reference"
          },
          "title": "References",
          "type": "array"
        }
      },
      "required": [
        "expression"
      ],
      "title": "BearerModel",
      "type": "object"
    },
    "BenchmarkItem": {
      "additionalProperties": false,
      "description": "A single benchmark item: an implication paired with analyst verdicts.",
      "properties": {
        "id": {
          "title": "Id",
          "type": "string"
        },
        "premises": {
          "items": {
            "type": "string"
          },
          "title": "Premises",
          "type": "array"
        },
        "conclusions": {
          "items": {
            "type": "string"
          },
          "title": "Conclusions",
          "type": "array"
        },
        "analyst_verdicts": {
          "items": {
            "$ref": "#/$defs/Verdict"
          },
          "title": "Analyst Verdicts",
          "type": "array"
        },
        "tags": {
          "items": {
            "type": "string"
          },
          "title": "Tags",
          "type": "array"
        },
        "rsr_target": {
          "anyOf": [
            {
              "$ref": "#/$defs/RSRTarget"
            },
            {
              "type": "null"
            }
          ],
          "default": null
        },
        "references": {
          "items": {
            "$ref": "#/$defs/Reference"
          },
          "title": "References",
          "type": "array"
        },
        "factor_levels": {
          "additionalProperties": {
            "type": "string"
          },
          "title": "Factor Levels",
          "type": "object"
        }
      },
      "required": [
        "id",
        "premises",
        "conclusions",
        "analyst_verdicts"
      ],
      "title": "BenchmarkItem",
      "type": "object"
    },
    "ContextBuilders": {
      "additionalProperties": false,
      "description": "Pair of context builders for :math:`\\mathrm{ctx}_\\Gamma` and :math:`\\mathrm{ctx}_\\Delta`.",
      "properties": {
        "premise": {
          "discriminator": {
            "mapping": {
              "plugin": "#/$defs/PluginContextBuilder",
              "template": "#/$defs/TemplateContextBuilder"
            },
            "propertyName": "kind"
          },
          "oneOf": [
            {
              "$ref": "#/$defs/TemplateContextBuilder"
            },
            {
              "$ref": "#/$defs/PluginContextBuilder"
            }
          ],
          "title": "Premise"
        },
        "conclusion": {
          "discriminator": {
            "mapping": {
              "plugin": "#/$defs/PluginContextBuilder",
              "template": "#/$defs/TemplateContextBuilder"
            },
            "propertyName": "kind"
          },
          "oneOf": [
            {
              "$ref": "#/$defs/TemplateContextBuilder"
            },
            {
              "$ref": "#/$defs/PluginContextBuilder"
            }
          ],
          "title": "Conclusion"
        }
      },
      "title": "ContextBuilders",
      "type": "object"
    },
    "FactorConstraints": {
      "additionalProperties": false,
      "description": "Constraints the benchmark validator should enforce on the factorial design.\n\nCurrently supports ``min_items_per_cell``: every cell of the *fully\ncrossed* design (cartesian product of all declared factor levels)\nmust contain at least this many items, where a cell is defined by\nthe per-factor level assignments in :attr:`BenchmarkItem.factor_levels`.\n\nPer *Closing the Construct-Validity Gap in infereval* (Phase 1.1)\naddressing requirement R7 (multiple items per condition) and\nsupporting R12 (per-condition decomposition).",
      "properties": {
        "min_items_per_cell": {
          "anyOf": [
            {
              "type": "integer"
            },
            {
              "type": "null"
            }
          ],
          "default": null,
          "title": "Min Items Per Cell"
        }
      },
      "title": "FactorConstraints",
      "type": "object"
    },
    "PluginContextBuilder": {
      "additionalProperties": false,
      "description": "A context builder specified by a dotted import path.\n\nThe plugin must resolve to a callable ``(Sequence[str]) -> str`` taking\nbearer expressions and returning the natural-language context.",
      "properties": {
        "kind": {
          "const": "plugin",
          "default": "plugin",
          "title": "Kind",
          "type": "string"
        },
        "plugin": {
          "title": "Plugin",
          "type": "string"
        }
      },
      "required": [
        "plugin"
      ],
      "title": "PluginContextBuilder",
      "type": "object"
    },
    "RSRTarget": {
      "additionalProperties": false,
      "description": "Target inference :math:`\\langle X, A \\rangle` for an RSR-targeted item.\n\nSee revised.tex Remark on \"RSR-targeted benchmarks\".",
      "properties": {
        "X": {
          "items": {
            "type": "string"
          },
          "title": "X",
          "type": "array"
        },
        "A": {
          "items": {
            "type": "string"
          },
          "title": "A",
          "type": "array"
        }
      },
      "required": [
        "X",
        "A"
      ],
      "title": "RSRTarget",
      "type": "object"
    },
    "Reference": {
      "additionalProperties": false,
      "description": "A traceable provenance entry for a benchmark, bearer, or item.\n\nThe motivating use case is regulated-domain benchmarks (medical, legal,\nfinancial) where every non-trivial implication needs a citation to a\nguideline, statute, or peer-reviewed source. Recording these as\nstructured objects lets downstream tooling render bibliographies,\nvalidate DOIs, and connect items to the documents that justify them.\n\nOnly :attr:`citation` is required. The other fields populate when the\nrelevant identifier is known and remain ``None`` otherwise.\n\nAuthoring shorthand: a plain string in any ``references`` list is\nauto-promoted to a :class:`Reference` with the string as\n:attr:`citation` and everything else ``None``. See\n:func:`_promote_reference_shorthand`.",
      "properties": {
        "citation": {
          "title": "Citation",
          "type": "string"
        },
        "doi": {
          "anyOf": [
            {
              "type": "string"
            },
            {
              "type": "null"
            }
          ],
          "default": null,
          "title": "Doi"
        },
        "url": {
          "anyOf": [
            {
              "type": "string"
            },
            {
              "type": "null"
            }
          ],
          "default": null,
          "title": "Url"
        },
        "section": {
          "anyOf": [
            {
              "type": "string"
            },
            {
              "type": "null"
            }
          ],
          "default": null,
          "title": "Section"
        },
        "note": {
          "anyOf": [
            {
              "type": "string"
            },
            {
              "type": "null"
            }
          ],
          "default": null,
          "title": "Note"
        }
      },
      "required": [
        "citation"
      ],
      "title": "Reference",
      "type": "object"
    },
    "TemplateContextBuilder": {
      "additionalProperties": false,
      "description": "A context builder specified by an inline template string.\n\nThe template is a format string with a single ``{expressions}`` placeholder.\nBearer expressions are joined by ``joiner`` to fill it.",
      "properties": {
        "kind": {
          "const": "template",
          "default": "template",
          "title": "Kind",
          "type": "string"
        },
        "template": {
          "default": "{expressions}",
          "title": "Template",
          "type": "string"
        },
        "joiner": {
          "default": " and ",
          "title": "Joiner",
          "type": "string"
        }
      },
      "title": "TemplateContextBuilder",
      "type": "object"
    },
    "Verdict": {
      "description": "Endorsement verdict :math:`E_M(\\langle \\Gamma, \\Delta \\rangle)`.\n\nString-valued so JSON serialization yields ``\"good\"`` / ``\"bad\"`` / ``\"abstain\"``\ndirectly. The ``(str, Enum)`` pattern is used in place of\n:class:`enum.StrEnum` for Python 3.10 compatibility.",
      "enum": [
        "good",
        "bad",
        "abstain"
      ],
      "title": "Verdict",
      "type": "string"
    },
    "VerificationPromptOverride": {
      "additionalProperties": false,
      "description": "Optional benchmark-level override of the framework's default verification prompt.\n\nAll four fields are optional in practice (``template`` is required by\nthe schema since it is the minimal thing an override needs to\ncontribute). When a field is ``None`` the framework default is used:\n\n- :attr:`system` ``None`` \u2192 :data:`infereval.prompts.DEFAULT_SYSTEM_PROMPT`.\n- :attr:`parse_regex` ``None`` \u2192 :data:`infereval.prompts.DEFAULT_PARSE_REGEX`.\n- :attr:`id` ``None`` \u2192 the caller-supplied ``override_id`` parameter to\n  :func:`infereval.prompts.resolve_verification_prompt`.\n\nAdding the ``system`` field makes the paraphrase-axis experiment\nfully JSON-drivable (no Python required to vary the verification prompt).",
      "properties": {
        "template": {
          "title": "Template",
          "type": "string"
        },
        "system": {
          "anyOf": [
            {
              "type": "string"
            },
            {
              "type": "null"
            }
          ],
          "default": null,
          "title": "System"
        },
        "parse_regex": {
          "anyOf": [
            {
              "type": "string"
            },
            {
              "type": "null"
            }
          ],
          "default": null,
          "title": "Parse Regex"
        },
        "id": {
          "anyOf": [
            {
              "type": "string"
            },
            {
              "type": "null"
            }
          ],
          "default": null,
          "title": "Id"
        }
      },
      "required": [
        "template"
      ],
      "title": "VerificationPromptOverride",
      "type": "object"
    }
  },
  "additionalProperties": false,
  "description": "A benchmark :math:`\\beta` over a bearer set, analyst panel, and items.\n\nSee revised.tex Definition 4.",
  "properties": {
    "schema_version": {
      "const": "1.0",
      "default": "1.0",
      "title": "Schema Version",
      "type": "string"
    },
    "id": {
      "title": "Id",
      "type": "string"
    },
    "title": {
      "anyOf": [
        {
          "type": "string"
        },
        {
          "type": "null"
        }
      ],
      "default": null,
      "title": "Title"
    },
    "domain": {
      "anyOf": [
        {
          "type": "string"
        },
        {
          "type": "null"
        }
      ],
      "default": null,
      "title": "Domain"
    },
    "description": {
      "anyOf": [
        {
          "type": "string"
        },
        {
          "type": "null"
        }
      ],
      "default": null,
      "title": "Description"
    },
    "bearers": {
      "additionalProperties": {
        "$ref": "#/$defs/BearerModel"
      },
      "title": "Bearers",
      "type": "object"
    },
    "analysts": {
      "items": {
        "$ref": "#/$defs/AnalystModel"
      },
      "minItems": 1,
      "title": "Analysts",
      "type": "array"
    },
    "context_builders": {
      "$ref": "#/$defs/ContextBuilders"
    },
    "verification_prompt": {
      "anyOf": [
        {
          "$ref": "#/$defs/VerificationPromptOverride"
        },
        {
          "type": "null"
        }
      ],
      "default": null
    },
    "items": {
      "items": {
        "$ref": "#/$defs/BenchmarkItem"
      },
      "title": "Items",
      "type": "array"
    },
    "factors": {
      "additionalProperties": {
        "items": {
          "type": "string"
        },
        "type": "array"
      },
      "title": "Factors",
      "type": "object"
    },
    "factor_constraints": {
      "anyOf": [
        {
          "$ref": "#/$defs/FactorConstraints"
        },
        {
          "type": "null"
        }
      ],
      "default": null
    },
    "references": {
      "items": {
        "$ref": "#/$defs/Reference"
      },
      "title": "References",
      "type": "array"
    }
  },
  "required": [
    "id",
    "bearers",
    "analysts",
    "items"
  ],
  "type": "object"
}
